{
  "schema_version": 1,
  "content_plan_id": "content_plan_8b4a8acfa9f2ecaa",
  "app_id": "zhiyu_ai_hk",
  "fact_snapshot_id": "fact_snapshot_7c19e04928e8cc09",
  "diagnosis_report_id": "diagnosis_report_ec40caa8c9af4055",
  "scenario_library_id": "scenario_library_a4f3ddb3c407ac41",
  "scenario_library_version": 1,
  "lifecycle": "confirmed",
  "version": 1,
  "based_on_content_plan_id": null,
  "created_at": "2026-08-07T13:08:10Z",
  "confirmed_at": "2026-08-07T13:12:29Z",
  "fact_catalog": [
    {
      "fact_id": "fact_0ab97039e8596770",
      "field": "company_name",
      "summary": "知鱼（ZhiYu）"
    },
    {
      "fact_id": "fact_da3d556f3b2d7832",
      "field": "company_short_name",
      "summary": "知鱼"
    },
    {
      "fact_id": "fact_354009bdaa29f8af",
      "field": "intro",
      "summary": "知鱼（ZhiYu）是一款融合东方命理智慧与现代 AI 技术的自我认知工具。名字取自《庄子·秋水》“子非鱼，安知鱼之乐”。知鱼不算命，而是帮用户看清自己：以传统命理模型为底层框架，结合 AI 语义理解与专属记忆，提供可核验计算过程的认知镜像。"
    },
    {
      "fact_id": "fact_d2bb69e415440f50",
      "field": "products_services",
      "summary": "提供六爻问事、知鱼 AI 私人顾问、八字原局与流年解读、档案合盘与连续对话记忆。支持农历输入自动转阳历，并按出生地经纬度计算真太阳时后再排盘；紫微与八字可叠加印证。鱼丸为通用积分，可用于解读与深度对话。公开会员标价为月卡 ¥99、年卡 ¥599。访问入口只记在企业名片，不写入介绍正文。"
    },
    {
      "fact_id": "fact_94de6f7175d8f613",
      "field": "advantages",
      "summary": "核心差异是真实排盘工具补足与可见的工具调用过程，避免“排盘靠猜”。相对西方测评框架，更贴合中国人的时间观、阴阳观与关系观；强调 AI 深度记忆、工具而非预言，赋能自知与决策，而非制造迷信依赖。"
    },
    {
      "fact_id": "fact_86b1751053d95a7c",
      "field": "trust",
      "summary": "公开用户反馈提到：能读懂性格矛盾而非泛泛而谈；六爻问事帮助把模糊担忧说清楚；AI 记得过往对话。早期用户已在使用并持续迭代。用户量、营收、合作分成等内部数字不作为公开事实。"
    },
    {
      "fact_id": "fact_9cb815a23b7858dd",
      "field": "pain_points",
      "summary": "市面命理类 AI 常见排盘靠猜，结果难以核验；西方测评框架对中国用户不够贴合；焦虑上升需要自我认知工具，但不愿陷入迷信依赖；农历与真太阳时门槛高，普通人难以自行处理"
    },
    {
      "fact_id": "fact_0245b72d7d499d87",
      "field": "name",
      "summary": "知鱼命理AI"
    },
    {
      "fact_id": "fact_d3884a88aac534c1",
      "field": "category",
      "summary": "东方命理自我认知工具"
    },
    {
      "fact_id": "fact_507fbf776ea8478a",
      "field": "selling_points",
      "summary": "先调用真实排盘工具再解读，避免排盘靠猜；思考与工具调用过程对用户可见；支持农历转阳历与真太阳时校正后排盘；八字与紫微可叠加印证，并具备对话记忆"
    },
    {
      "fact_id": "fact_461ab2a049b5735a",
      "field": "attributes",
      "summary": "product_type: SaaS / AI Agent；core_modules: 六爻问事、知鱼AI顾问、八字原局、档案合盘；access_urls: https://zhiyu.hk ; https://app.zhiyu.hk；membership_price: 月卡 ¥99；年卡 ¥599"
    },
    {
      "fact_id": "fact_7242717f4786405c",
      "field": "capabilities",
      "summary": "六爻问事解读；八字原局与流年解读；命理图谱记忆与情绪陪伴对话；农历/真太阳时自动处理；合盘与档案连续对话"
    },
    {
      "fact_id": "fact_6423b84f4446063d",
      "field": "is_main",
      "summary": "是"
    },
    {
      "fact_id": "fact_b852f5a695ab809f",
      "field": "website_or_shop_url",
      "summary": "https://app.zhiyu.hk"
    }
  ],
  "faq_candidates": [
    {
      "faq_id": "faq_candidate_6525e77b6bfd1de1",
      "question": "知鱼是做什么的？是算命软件还是自我认知工具？",
      "normalized_question": "知鱼是做什么的是算命软件还是自我认知工具",
      "answer_goal": "解释可核验的比较维度，不做无依据排名",
      "target_audience": "第一次听说「知鱼」的中文用户，常被同名品牌或算命软件干扰",
      "scenario_id": "scenario_4e179e74beeb029d",
      "question_ids": [
        "scenario_question_cc76aba6e94a0b8e"
      ],
      "allowed_fact_ids": [
        "fact_0ab97039e8596770",
        "fact_da3d556f3b2d7832",
        "fact_354009bdaa29f8af",
        "fact_d2bb69e415440f50",
        "fact_94de6f7175d8f613",
        "fact_b852f5a695ab809f"
      ],
      "evidence_gap_ids": [],
      "readiness": "ready",
      "review_status": "approved",
      "review_note": null,
      "source_refs": [
        {
          "source_ref_id": "scenario_source_144736e923a4b29e",
          "kind": "fact",
          "ref_id": "fact_0ab97039e8596770",
          "path": null,
          "original_bucket": null,
          "text": "知鱼（ZhiYu）",
          "derivation": "extracted"
        },
        {
          "source_ref_id": "scenario_source_531ee55894f68514",
          "kind": "fact",
          "ref_id": "fact_da3d556f3b2d7832",
          "path": null,
          "original_bucket": null,
          "text": "知鱼",
          "derivation": "extracted"
        },
        {
          "source_ref_id": "scenario_source_908e475839a0db7b",
          "kind": "fact",
          "ref_id": "fact_354009bdaa29f8af",
          "path": null,
          "original_bucket": null,
          "text": "知鱼（ZhiYu）是一款融合东方命理智慧与现代 AI 技术的自我认知工具。名字取自《庄子·秋水》“子非鱼，安知鱼之乐”。知鱼不算命，而是帮用户看清自己：以传统命理模型为底层框架，结合 AI 语义理解与专属记忆，提供可核验计算过程的认知镜像。",
          "derivation": "operator"
        },
        {
          "source_ref_id": "scenario_source_24b5485b05ae7608",
          "kind": "fact",
          "ref_id": "fact_d2bb69e415440f50",
          "path": null,
          "original_bucket": null,
          "text": "提供六爻问事、知鱼 AI 私人顾问、八字原局与流年解读、档案合盘与连续对话记忆。支持农历输入自动转阳历，并按出生地经纬度计算真太阳时后再排盘；紫微与八字可叠加印证。鱼丸为通用积分，可用于解读与深度对话。公开会员标价为月卡 ¥99、年卡 ¥599。访问入口只记在企业名片，不写入介绍正文。",
          "derivation": "operator"
        },
        {
          "source_ref_id": "scenario_source_3e09a276b1717a4e",
          "kind": "fact",
          "ref_id": "fact_94de6f7175d8f613",
          "path": null,
          "original_bucket": null,
          "text": "核心差异是真实排盘工具补足与可见的工具调用过程，避免“排盘靠猜”。相对西方测评框架，更贴合中国人的时间观、阴阳观与关系观；强调 AI 深度记忆、工具而非预言，赋能自知与决策，而非制造迷信依赖。",
          "derivation": "operator"
        },
        {
          "source_ref_id": "scenario_source_9ab24f7c7671b6e6",
          "kind": "fact",
          "ref_id": "fact_b852f5a695ab809f",
          "path": null,
          "original_bucket": null,
          "text": "https://app.zhiyu.hk",
          "derivation": "operator"
        },
        {
          "source_ref_id": "scenario_source_94d938fa302da37b",
          "kind": "operator",
          "ref_id": "operator_input_ef15aeb6a5dc105f",
          "path": "/Users/bouda/work/geo/projects/知鱼/strategy/operator-scenario-input.json",
          "original_bucket": null,
          "text": "知鱼是做什么的？是算命软件还是自我认知工具？",
          "derivation": "operator"
        }
      ]
    },
    {
      "faq_id": "faq_candidate_e5241370f506ae43",
      "question": "有哪些靠谱的东方命理AI或自我认知工具？知鱼适合怎么比较？",
      "normalized_question": "有哪些靠谱的东方命理ai或自我认知工具知鱼适合怎么比较",
      "answer_goal": "提供供应商或产品筛选依据，不做无证据推荐",
      "target_audience": "在比较命理AI/东方测评工具的个人用户",
      "scenario_id": "scenario_e956564fc9e0e131",
      "question_ids": [
        "scenario_question_930d917e66e1d85c"
      ],
      "allowed_fact_ids": [
        "fact_d2bb69e415440f50",
        "fact_94de6f7175d8f613",
        "fact_9cb815a23b7858dd",
        "fact_0245b72d7d499d87",
        "fact_d3884a88aac534c1",
        "fact_507fbf776ea8478a",
        "fact_7242717f4786405c"
      ],
      "evidence_gap_ids": [],
      "readiness": "ready",
      "review_status": "approved",
      "review_note": null,
      "source_refs": [
        {
          "source_ref_id": "scenario_source_24b5485b05ae7608",
          "kind": "fact",
          "ref_id": "fact_d2bb69e415440f50",
          "path": null,
          "original_bucket": null,
          "text": "提供六爻问事、知鱼 AI 私人顾问、八字原局与流年解读、档案合盘与连续对话记忆。支持农历输入自动转阳历，并按出生地经纬度计算真太阳时后再排盘；紫微与八字可叠加印证。鱼丸为通用积分，可用于解读与深度对话。公开会员标价为月卡 ¥99、年卡 ¥599。访问入口只记在企业名片，不写入介绍正文。",
          "derivation": "operator"
        },
        {
          "source_ref_id": "scenario_source_3e09a276b1717a4e",
          "kind": "fact",
          "ref_id": "fact_94de6f7175d8f613",
          "path": null,
          "original_bucket": null,
          "text": "核心差异是真实排盘工具补足与可见的工具调用过程，避免“排盘靠猜”。相对西方测评框架，更贴合中国人的时间观、阴阳观与关系观；强调 AI 深度记忆、工具而非预言，赋能自知与决策，而非制造迷信依赖。",
          "derivation": "operator"
        },
        {
          "source_ref_id": "scenario_source_74e802f7d1072830",
          "kind": "fact",
          "ref_id": "fact_9cb815a23b7858dd",
          "path": null,
          "original_bucket": null,
          "text": "市面命理类 AI 常见排盘靠猜，结果难以核验；西方测评框架对中国用户不够贴合；焦虑上升需要自我认知工具，但不愿陷入迷信依赖；农历与真太阳时门槛高，普通人难以自行处理",
          "derivation": "operator"
        },
        {
          "source_ref_id": "scenario_source_79424857e5879e66",
          "kind": "fact",
          "ref_id": "fact_0245b72d7d499d87",
          "path": null,
          "original_bucket": null,
          "text": "知鱼命理AI",
          "derivation": "operator"
        },
        {
          "source_ref_id": "scenario_source_11dc82b3afe9a573",
          "kind": "fact",
          "ref_id": "fact_d3884a88aac534c1",
          "path": null,
          "original_bucket": null,
          "text": "东方命理自我认知工具",
          "derivation": "derived"
        },
        {
          "source_ref_id": "scenario_source_7efd02078ade9807",
          "kind": "fact",
          "ref_id": "fact_507fbf776ea8478a",
          "path": null,
          "original_bucket": null,
          "text": "先调用真实排盘工具再解读，避免排盘靠猜；思考与工具调用过程对用户可见；支持农历转阳历与真太阳时校正后排盘；八字与紫微可叠加印证，并具备对话记忆",
          "derivation": "derived"
        },
        {
          "source_ref_id": "scenario_source_f9637fe3093c5e48",
          "kind": "fact",
          "ref_id": "fact_7242717f4786405c",
          "path": null,
          "original_bucket": null,
          "text": "六爻问事解读；八字原局与流年解读；命理图谱记忆与情绪陪伴对话；农历/真太阳时自动处理；合盘与档案连续对话",
          "derivation": "derived"
        },
        {
          "source_ref_id": "scenario_source_585b6cc7cac62b3d",
          "kind": "operator",
          "ref_id": "operator_input_5117fd3222337a42",
          "path": "/Users/bouda/work/geo/projects/知鱼/strategy/operator-scenario-input.json",
          "original_bucket": null,
          "text": "有哪些靠谱的东方命理AI或自我认知工具？知鱼适合怎么比较？",
          "derivation": "operator"
        }
      ]
    },
    {
      "faq_id": "faq_candidate_6fbcc0027c2990f3",
      "question": "知鱼命理AI支持哪些核心功能？八字、六爻、合盘和真太阳时怎么处理？",
      "normalized_question": "知鱼命理ai支持哪些核心功能八字六爻合盘和真太阳时怎么处理",
      "answer_goal": "提供供应商或产品筛选依据，不做无证据推荐",
      "target_audience": "已产生兴趣、想确认功能边界的试用意向用户",
      "scenario_id": "scenario_59993d5e280bc76d",
      "question_ids": [
        "scenario_question_42a010176b43fe41"
      ],
      "allowed_fact_ids": [